00:02.0 USB controller [0c03]: Intel Corporation 82801FB/FBM/FR/FW/FRW (ICH6 Family) USB2 EHCI Controller [8086:265c] (rev 02) (prog-if 20 [EHCI])
	Subsystem: Parallels, Inc. 82801FB/FBM/FR/FW/FRW (ICH6 Family) USB2 EHCI Controller [1ab8:0400]
	Control: I/O+ Mem+ BusMaster+ SpecCycle- MemWINV+ VGASnoop- ParErr- Stepping- SERR- FastB2B- DisINTx-
	Status: Cap- 66MHz- UDF- FastB2B+ ParErr- DEVSEL=medium >TAbort- <TAbort- <MAbort- >SERR- <PERR- INTx-
	Latency: 0
	Interrupt: pin A routed to IRQ 23
	Region 0: Memory at 14012000 (32-bit, non-prefetchable) [size=1K]
	Kernel driver in use: ehci-pci

00:03.0 USB controller [0c03]: NEC Corporation uPD720200 USB 3.0 Host Controller [1033:0194] (rev 04) (prog-if 30 [XHCI])
	Subsystem: Parallels, Inc. uPD720200 USB 3.0 Host Controller [1ab8:0400]
	Control: I/O- Mem+ BusMaster+ SpecCycle- MemWINV+ VGASnoop- ParErr- Stepping- SERR- FastB2B- DisINTx+
	Status: Cap+ 66MHz- UDF- FastB2B+ ParErr- DEVSEL=medium >TAbort- <TAbort- <MAbort- >SERR- <PERR- INTx-
	Latency: 0
	Interrupt: pin A routed to IRQ 26
	Region 0: Memory at 1400c000 (32-bit, non-prefetchable) [size=4K]
	Capabilities: [e0] MSI: Enable+ Count=1/1 Maskable+ 64bit-
		Address: 02250040  Data: 0038
		Masking: 00000000  Pending: 00000000
	Kernel driver in use: xhci_hcd
	Kernel modules: xhci_pci

