00:01.0 Audio device [0403]: Intel Corporation 82801I (ICH9 Family) HD Audio Controller [8086:293e]
	Subsystem: Parallels, Inc. 82801I (ICH9 Family) HD Audio Controller [1ab8:0400]
	Control: I/O- Mem+ BusMaster+ SpecCycle- MemWINV- VGASnoop- ParErr- Stepping- SERR- FastB2B- DisINTx+
	Status: Cap+ 66MHz- UDF- FastB2B- ParErr- DEVSEL=fast >TAbort- <TAbort- <MAbort- >SERR- <PERR- INTx-
	Latency: 0
	Interrupt: pin A routed to IRQ 32
	Region 0: Memory at 14000000 (32-bit, non-prefetchable) [size=16K]
	Capabilities: [78] Express (v2) Endpoint, MSI 00
		DevCap:	MaxPayload 128 bytes, PhantFunc 0, Latency L0s unlimited, L1 unlimited
			ExtTag- AttnBtn- AttnInd- PwrInd- RBE- FLReset- SlotPowerLimit 0W
		DevCtl:	CorrErr- NonFatalErr- FatalErr- UnsupReq-
			RlxdOrd+ ExtTag- PhantFunc- AuxPwr- NoSnoop-
			MaxPayload 128 bytes, MaxReadReq 512 bytes
		DevSta:	CorrErr- NonFatalErr- FatalErr- UnsupReq- AuxPwr- TransPend-
		LnkCap:	Port #0, Speed 2.5GT/s, Width x1, ASPM not supported
			ClockPM- Surprise- LLActRep- BwNot- ASPMOptComp-
		LnkCtl:	ASPM Disabled; RCB 64 bytes, Disabled- CommClk-
			ExtSynch- ClockPM- AutWidDis- BWInt- AutBWInt-
		LnkSta:	Speed 2.5GT/s, Width x1
			TrErr- Train- SlotClk+ DLActive- BWMgmt- ABWMgmt-
		DevCap2: Completion Timeout: Not Supported, TimeoutDis- NROPrPrP- LTR-
			 10BitTagComp- 10BitTagReq- OBFF Not Supported, ExtFmt- EETLPPrefix-
			 EmergencyPowerReduction Not Supported, EmergencyPowerReductionInit-
			 FRS- TPHComp- ExtTPHComp-
			 AtomicOpsCap: 32bit- 64bit- 128bitCAS-
		DevCtl2: Completion Timeout: 50us to 50ms, TimeoutDis- LTR- 10BitTagReq- OBFF Disabled,
			 AtomicOpsCtl: ReqEn-
		LnkSta2: Current De-emphasis Level: -6dB, EqualizationComplete- EqualizationPhase1-
			 EqualizationPhase2- EqualizationPhase3- LinkEqualizationRequest-
			 Retimer- 2Retimers- CrosslinkRes: unsupported
	Capabilities: [60] MSI: Enable+ Count=1/1 Maskable+ 64bit-
		Address: 02250040  Data: 003d
		Masking: 00000000  Pending: 00000000
	Kernel driver in use: snd_hda_intel
	Kernel modules: snd_hda_intel

00:02.0 USB controller [0c03]: Intel Corporation 82801FB/FBM/FR/FW/FRW (ICH6 Family) USB2 EHCI Controller [8086:265c] (rev 02) (prog-if 20 [EHCI])
	Subsystem: Parallels, Inc. 82801FB/FBM/FR/FW/FRW (ICH6 Family) USB2 EHCI Controller [1ab8:0400]
	Control: I/O+ Mem+ BusMaster+ SpecCycle- MemWINV+ VGASnoop- ParErr- Stepping- SERR- FastB2B- DisINTx-
	Status: Cap- 66MHz- UDF- FastB2B+ ParErr- DEVSEL=medium >TAbort- <TAbort- <MAbort- >SERR- <PERR- INTx-
	Latency: 0
	Interrupt: pin A routed to IRQ 23
	Region 0: Memory at 14012000 (32-bit, non-prefetchable) [size=1K]
	Kernel driver in use: ehci-pci

00:03.0 USB controller [0c03]: NEC Corporation uPD720200 USB 3.0 Host Controller [1033:0194] (rev 04) (prog-if 30 [XHCI])
	Subsystem: Parallels, Inc. uPD720200 USB 3.0 Host Controller [1ab8:0400]
	Control: I/O- Mem+ BusMaster+ SpecCycle- MemWINV+ VGASnoop- ParErr- Stepping- SERR- FastB2B- DisINTx+
	Status: Cap+ 66MHz- UDF- FastB2B+ ParErr- DEVSEL=medium >TAbort- <TAbort- <MAbort- >SERR- <PERR- INTx-
	Latency: 0
	Interrupt: pin A routed to IRQ 26
	Region 0: Memory at 1400c000 (32-bit, non-prefetchable) [size=4K]
	Capabilities: [e0] MSI: Enable+ Count=1/1 Maskable+ 64bit-
		Address: 02250040  Data: 0038
		Masking: 00000000  Pending: 00000000
	Kernel driver in use: xhci_hcd
	Kernel modules: xhci_pci

00:05.0 Ethernet controller [0200]: Red Hat, Inc. Virtio network device [1af4:1000]
	Subsystem: Parallels, Inc. Virtio network device [1ab8:0001]
	Control: I/O+ Mem+ BusMaster+ SpecCycle- MemWINV- VGASnoop- ParErr- Stepping- SERR- FastB2B- DisINTx+
	Status: Cap+ 66MHz- UDF- FastB2B- ParErr- DEVSEL=fast >TAbort- <TAbort- <MAbort- >SERR- <PERR- INTx-
	Latency: 0
	Interrupt: pin A routed to IRQ 17
	Region 0: Memory at 1400d000 (32-bit, non-prefetchable) [size=4K]
	Region 1: Memory at 1400e000 (32-bit, non-prefetchable) [size=4K]
	Capabilities: [48] Express (v2) Endpoint, MSI 00
		DevCap:	MaxPayload 128 bytes, PhantFunc 0, Latency L0s unlimited, L1 unlimited
			ExtTag- AttnBtn- AttnInd- PwrInd- RBE- FLReset- SlotPowerLimit 0W
		DevCtl:	CorrErr- NonFatalErr- FatalErr- UnsupReq-
			RlxdOrd+ ExtTag- PhantFunc- AuxPwr- NoSnoop-
			MaxPayload 128 bytes, MaxReadReq 512 bytes
		DevSta:	CorrErr- NonFatalErr- FatalErr- UnsupReq- AuxPwr- TransPend-
		LnkCap:	Port #0, Speed 2.5GT/s, Width x1, ASPM not supported
			ClockPM- Surprise- LLActRep- BwNot- ASPMOptComp-
		LnkCtl:	ASPM Disabled; RCB 64 bytes, Disabled- CommClk-
			ExtSynch- ClockPM- AutWidDis- BWInt- AutBWInt-
		LnkSta:	Speed 2.5GT/s, Width x1
			TrErr- Train- SlotClk+ DLActive- BWMgmt- ABWMgmt-
		DevCap2: Completion Timeout: Not Supported, TimeoutDis- NROPrPrP- LTR-
			 10BitTagComp- 10BitTagReq- OBFF Not Supported, ExtFmt- EETLPPrefix-
			 EmergencyPowerReduction Not Supported, EmergencyPowerReductionInit-
			 FRS- TPHComp- ExtTPHComp-
			 AtomicOpsCap: 32bit- 64bit- 128bitCAS-
		DevCtl2: Completion Timeout: 50us to 50ms, TimeoutDis- LTR- 10BitTagReq- OBFF Disabled,
			 AtomicOpsCtl: ReqEn-
		LnkSta2: Current De-emphasis Level: -6dB, EqualizationComplete- EqualizationPhase1-
			 EqualizationPhase2- EqualizationPhase3- LinkEqualizationRequest-
			 Retimer- 2Retimers- CrosslinkRes: unsupported
	Capabilities: [40] Power Management version 2
		Flags: PMEClk- DSI+ D1- D2- AuxCurrent=0mA PME(D0-,D1-,D2-,D3hot-,D3cold-)
		Status: D0 NoSoftRst- PME-Enable- DSel=0 DScale=0 PME-
	Capabilities: [f4] MSI-X: Enable+ Count=3 Masked-
		Vector table: BAR=1 offset=00000000
		PBA: BAR=1 offset=00000800
	Capabilities: [100 v1] Device Serial Number 00-1c-42-ff-ff-a7-82-79
	Kernel driver in use: virtio-pci

00:09.0 Unassigned class [ff00]: Parallels, Inc. Virtual Machine Communication Interface [1ab8:4000]
	Subsystem: Parallels, Inc. Virtual Machine Communication Interface [1ab8:0400]
	Control: I/O- Mem- BusMaster- SpecCycle- MemWINV+ VGASnoop- ParErr- Stepping- SERR- FastB2B- DisINTx-
	Status: Cap+ 66MHz- UDF- FastB2B+ ParErr- DEVSEL=medium >TAbort- <TAbort- <MAbort- >SERR- <PERR- INTx-
	Interrupt: pin A routed to IRQ 255
	Region 0: Memory at 1400f000 (32-bit, non-prefetchable) [disabled] [size=4K]
	Capabilities: [40] MSI: Enable- Count=1/4 Maskable+ 64bit+
		Address: 0000000000000000  Data: 0000
		Masking: 00000000  Pending: 00000000

00:0a.0 VGA compatible controller [0300]: Red Hat, Inc. Virtio 1.0 GPU [1af4:1050] (rev 01) (prog-if 00 [VGA controller])
	Subsystem: Parallels, Inc. Virtio 1.0 GPU [1ab8:0010]
	Control: I/O+ Mem+ BusMaster+ SpecCycle- MemWINV- VGASnoop- ParErr- Stepping- SERR- FastB2B- DisINTx+
	Status: Cap+ 66MHz- UDF- FastB2B- ParErr- DEVSEL=fast >TAbort- <TAbort- <MAbort- >SERR- <PERR- INTx-
	Latency: 0
	Interrupt: pin A routed to IRQ 18
	Region 0: Memory at 10000000 (32-bit, prefetchable) [size=64M]
	Region 1: Memory at 14010000 (32-bit, non-prefetchable) [size=4K]
	Region 4: Memory at 14004000 (32-bit, non-prefetchable) [size=16K]
	Capabilities: [b0] MSI-X: Enable+ Count=2 Masked-
		Vector table: BAR=1 offset=00000000
		PBA: BAR=1 offset=00000800
	Capabilities: [bc] Vendor Specific Information: VirtIO: DeviceCfg
		BAR=4 offset=00003000 size=00001000
	Capabilities: [cc] Vendor Specific Information: VirtIO: ISR
		BAR=4 offset=00002000 size=00001000
	Capabilities: [dc] Vendor Specific Information: VirtIO: Notify
		BAR=4 offset=00001000 size=00001000 multiplier=00000000
	Capabilities: [f0] Vendor Specific Information: VirtIO: CommonCfg
		BAR=4 offset=00000000 size=00001000
	Kernel driver in use: virtio-pci

00:0e.0 Communication controller [0780]: Red Hat, Inc. Virtio 1.0 socket [1af4:1053] (rev 01)
	Subsystem: Parallels, Inc. Virtio 1.0 socket [1ab8:0013]
	Control: I/O- Mem+ BusMaster+ SpecCycle- MemWINV- VGASnoop- ParErr- Stepping- SERR- FastB2B- DisINTx+
	Status: Cap+ 66MHz- UDF- FastB2B- ParErr- DEVSEL=fast >TAbort- <TAbort- <MAbort- >SERR- <PERR- INTx-
	Latency: 0
	Interrupt: pin A routed to IRQ 19
	Region 1: Memory at 14011000 (32-bit, non-prefetchable) [size=4K]
	Region 4: Memory at 14008000 (32-bit, non-prefetchable) [size=16K]
	Capabilities: [b0] MSI-X: Enable+ Count=2 Masked-
		Vector table: BAR=1 offset=00000000
		PBA: BAR=1 offset=00000800
	Capabilities: [bc] Vendor Specific Information: VirtIO: DeviceCfg
		BAR=4 offset=00003000 size=00001000
	Capabilities: [cc] Vendor Specific Information: VirtIO: ISR
		BAR=4 offset=00002000 size=00001000
	Capabilities: [dc] Vendor Specific Information: VirtIO: Notify
		BAR=4 offset=00001000 size=00001000 multiplier=00000000
	Capabilities: [f0] Vendor Specific Information: VirtIO: CommonCfg
		BAR=4 offset=00000000 size=00001000
	Kernel driver in use: virtio-pci

